Betbull Social Sports UK Limited London,true,[Tier2]
BETC London Limited London,true,"[Tier2, ICT]"
Betgenius Limited London,true,[Tier2]
Betgenius Limited London,true,"[Tier2, ICT]"
BeTomorrow UK Limited London,true,[Tier2]
Better World Charity Ltd LondonTemple Fortune,true,[Tier2]
Beverage Services Limited London,true,"[Tier2, ICT]"
BEYOND CREATIVE LIMITED LONDON,true,[Tier2]
Beyond Health Limited London,true,[Tier2]
BEYOND INTERNATIONAL SERVICES LTD LONDON,true,[Tier2]
"Beyond Luxury Media Ltd Shepherds Bush, London",true,[Tier2]
Beyond the Deal LLP London,true,[Tier2]
BFC BANK LIMITED LONDON,true,[Tier2]
BFIN Europe Holding Ltd (t/a BFIN Private Advisers UK LP & BFIN Real Estate London Ltd,true,"[Tier2, ICT]"
bfinance UK Limited London,true,[Tier2]
BG Infotech Ltd London,true,[Tier2]
BG&E Consulting Engineers Ltd London,true,[Tier2]
BGF Services Ltd London,true,[Tier2]
BGRS Global UK Limited London,true,"[Tier2, ICT]"
BGTA ACCELERATOR LTD LONDON,true,[Tier2]
Bharatiya Vidya Bhavan LONDON,true,"[Tier2, Creative]"
BH-DG Systematic Trading LLP London,true,[Tier2]
BHoldings Limited London,true,"[Tier2, ICT]"
BHP Billiton International Services Limited London,true,"[Tier2, ICT]"
BIBA Medical Limited London,true,[Tier2]
Bibblio Learning Limited LondonIslington,true,[Tier2]
Bibliotech Education Ltd London,true,[Tier2]
Bidfresh Limited London,true,[Tier2]
Big Education Trust London,true,[Tier2]
Big Fish Design Ltd London,true,[Tier2]
Big Health Ltd London,true,"[Tier2, ICT]"
Big Ideas Group Ltd London,true,[Tier2]
Big Innovation Centre London,true,[Tier2]
Big Mamma Holdings LTD London,true,[Tier2]
BIG Partners Ltd London,true,"[Tier2, ICT]"
Big Radical London,true,[Tier2]
Big Society Capital Ltd London,true,[Tier2]
Big Win Philanthropy London,true,[Tier2]
Big Worldwide Ltd London,true,[Tier2]
BigCommerce UK Ltd. London,true,"[Tier2, ICT]"
Bighams Ltd LondonPark Royal,true,[Tier2]
Bill & Melinda Gates Foundation London,true,"[Tier2, ICT]"
Billiaze Ltd London,true,[Tier2]
"Bill's Restaurants Ltd London",true,[Tier2]
Bindy Street Limited LondonFulham,true,[Tier2]
Binning Limited London,true,[Tier2]
Bio Luminuex Health Care Limited LONDON,true,[Tier2]
Biogen Restaurant Limited London,true,[Tier2]
BioIndustry Association London,true,[Tier2]
Bioline Reagents Ltd London,true,[Tier2]
BioMarin (UK) Limited London,true,"[Tier2, ICT]"
Biotronics3D Limited London,true,[Tier2]
BIRCH GROVE PROPERTY SERVICES LTD LONDON,true,[Tier2]
Bird & Bird LLP London,true,"[ICT, Tier2]"
Birkbeck College London,true,[Tier2]
Birlasoft (UK) Ltd London,true,"[Tier2, ICT]"
BIRUNTHA SOLICITORS LONDONLEWISHAM,true,[Tier2]
Bischell Construction Limited London,true,[Tier2]
Bishop Challoner Federation of Schools London,true,[Tier2]
Bishopsfield Capital Partners Limited London,true,[Tier2]
BISMILLAH HAJJ & UMRAH LTD London,true,[Tier2]
Bissell and Partners Ltd London,true,[Tier2]
Bisset Adams London,true,[Tier2]
BIT4ID LIMITED LondonPlaistow,true,[Tier2]
BJB Limited LondonLondon,true,[Tier2]
Bjorn Borg UK Limited London,true,[Tier2]
BKUK Group Limited London,true,"[Tier2, ICT]"
Black and Blum Limited London,true,[Tier2]
Black Book London Limited London,true,[Tier2]
Black Box Project Limited London,true,[Tier2]
Black Mountain Systems Limited London,true,"[Tier2, ICT]"
BLACK STAR CAPITAL LIMITED LONDON,true,[Tier2]
Black Sun Plc London,true,[Tier2]
Black Swan Data Limited LondonLondon,true,"[Tier2, ICT]"
"Black Tomato Ltd London,City ofLondon",true,[Tier2]
Blackbaud Europe Ltd London,true,"[Tier2, ICT]"
BLACKBOARD (UK) LIMITED London,true,"[Tier2, ICT]"
Blackbridge Communications LTD London,true,[Tier2]
Blackheath High School GDST London,true,"[Creative, Tier2]"
BlackLine Systems Limited London,true,"[Tier2, ICT]"
Blacklion Law LLP LondonLondon,true,[Tier2]
BLACKMILK MEDIA LTD LONDON,true,[Tier2]
Blackrock Expert Services LondonLondon,true,[Tier2]
BLACKROCK INVESTMENT MANAGEMENT (UK) LIMITED LONDON,true,"[Tier2, ICT]"
Blacksheep Creatives Ltd. London,true,[Tier2]
BLACKSTONE PROPERTY MANAGEMENT LIMITED LONDON,true,[Tier2]
Blackthorn GRC Limited London,true,[Tier2]
BLAIN SOUTHERN LIMITED LONDON,true,"[Tier2, ICT]"
BLAIZ LIMITED London,true,[Tier2]
Blaize Inc Ltd London,true,[Tier2]
Blakehampton Business Services Ltd London,true,[Tier2]
Blakeney LLP London,true,[Tier2]
Blantyre Capital Limited London,true,[Tier2]
Blass Design LLP London,true,[Tier2]
Blast ! Films Ltd NoneLondon,true,[Tier2]
Blast Design Limited London,true,[Tier2]
BLASTINGS NEWS LTD LONDON,true,"[ICT, Tier2]"
Blayze Consulting Group Limited London,true,[Tier2]
BLD Foundation Ltd London,true,[Tier2]
Blend Technology Consultants Ltd London,true,[Tier2]
BLENDCROSS LIMITED LONDON,true,[Tier2]
Blick Rothenberg Limited London,true,[Tier2]
Blink Productions Limited London,true,"[Creative, Tier2]"
Blippar.com Ltd United KingdonLondon,true,[Tier2]
Blis Media Limited London,true,[Tier2]
Bliss - The National Charity for the Newborn EnglandLondon,true,[Tier2]
Blissful Life Limited London,true,[Tier2]
Block Solutions Ltd London,true,[Tier2]
Blockchain (GB) Limited London,true,"[Tier2, ICT]"
BlockEx Limited London,true,[Tier2]
BLOM BANK FRANCE LONDON,true,[Tier2]
Blondie Fashion Limited London,true,[Tier2]
Bloom and Wild Limited Greater LondonLondon,true,[Tier2]
Bloom Design Limited London,true,[Tier2]
"Bloomberg LP London,",true,"[Tier2, ICT]"
Bloomon UK Ltd. London,true,[Tier2]
BloomReach UK Ltd London,true,"[Tier2, ICT]"
Bloomsbury Institute London,true,[Tier2]
Bloomsbury Publishing Plc London,true,[Tier2]
BLS INTERNATIONAL SERVICES (UK) Ltd LONDON,true,"[Tier2, ICT]"
Blue Cube (GB) Ltd London,true,[Tier2]
Blue Duck Education Ltd London,true,[Tier2]
BLUE HERON CATERING LIMITED T/A BANGALORE EXPRESS LONDON,true,[Tier2]
Blue Heron Research Partners (UK) Limited London,true,"[Tier2, ICT]"
Blue Inc (UK) Limited LondonWalthamstow,true,[Tier2]
Blue Jeans Network Limited London,true,"[Tier2, ICT]"
Blue Marlin Brand Design Limited London,true,"[Tier2, ICT]"
Blue Matter Consulting Ltd London,true,[Tier2]
Blue Mountain Capital Partners (London) LLP London,true,"[Tier2, ICT]"
Blue Prism Limited London,true,[Tier2]
Blue Ridge Partners Management Consulting (UK) Ltd London,true,"[Tier2, ICT]"
Blue Sky Hosting Ltd London,true,[Tier2]
Blue State Digital UK Limited London,true,"[Tier2, ICT]"
Blue Turtle Consulting UK Ltd London,true,"[Tier2, ICT]"
Blue Vision Labs UK Limited London,true,[Tier2]
BLUE VISION LABS UK LIMITED LONDON,true,"[Tier2, ICT]"
BLUE WATER ENERGY LLP London,true,[Tier2]
Blue Zoo Productions Limited London,true,[Tier2]
BlueBay Asset Management (Services) Limited London,true,"[Tier2, ICT]"
BlueBay Asset Management LLP London,true,"[Tier2, ICT]"
Bluebolt Limited London,true,"[Tier2, Creative]"
BlueCove Limited London,true,[Tier2]
BlueDrive Global Investors LLP London,true,[Tier2]
Bluefield Partners LLP London,true,[Tier2]
Bluefin Europe LLP London,true,"[Tier2, ICT]"
Blueglass Interactive UK Ltd London,true,[Tier2]
Bluejay Mining plc London,true,[Tier2]
BlueOptima Limited London,true,"[Tier2, ICT]"
Blueprint Models LTD London,true,[Tier2]
BluePrint Research Group Limited London,true,"[Tier2, ICT]"
BluePrint Research Group LLC LondonPaddington Central,true,"[Tier2, ICT]"
BlueRunner Solutions Limited London,true,[Tier2]
Bluetownonline Ltd London,true,[Tier2]
BM Interim Management Ltd London,true,[Tier2]
BM Polyco Ltd London,true,[Tier2]
BMC UK Subadvisor Support Ltd London,true,[Tier2]
BMCE Bank International London,true,"[Tier2, ICT]"
BME Global Limited London,true,"[Tier2, ICT]"
BMI Healthcare Limited London,true,"[ICT, Tier2]"
BMJ Group London,true,[Tier2]
BMLL Technologies Ltd London,true,[Tier2]
BMO Capital Markets Limited London,true,"[ICT, Tier2]"
BNK (UK) LIMITED LONDON,true,"[Tier2, ICT]"
BNP Paribas Asset Management UK Limited London,true,"[Tier2, ICT]"
BNP Paribas London Branch London,true,"[Tier2, ICT]"
BNP Paribas Securities Services London,true,[Tier2]
Board MIT Ltd London,true,"[Tier2, ICT]"
Boat Rocker Rights (UK) Ltd LondonLondon,true,"[ICT, Tier2, Creative]"
Bobrick Washroom Equipment Limited London,true,"[Tier2, ICT]"
BOC Aviation UK Limited London,true,"[Tier2, ICT]"
Boeing Defence UK Limited London,true,[Tier2]
Boerboel Trading LLP London,true,"[Tier2, ICT]"
BofA Merrill Lynch Merchant Services (Europe) Limited London,true,"[Tier2, ICT]"
BOGHOSSIAN LondonLondon,true,[Tier2]
Bogle Architects Ltd London,true,[Tier2]
Boies Schiller Flexner (UK) LLP London,true,"[Tier2, ICT]"
BOILER ROOM (UK) LIMITED London,true,"[Tier2, ICT]"
Boku Network Services UK Ltd London,true,[Tier2]
Bold Dragon Limited London,true,[Tier2]
Bolt Markets Ltd London,true,[Tier2]
Bond Finance Ltd London,true,[Tier2]
Bond Radar Ltd London,true,[Tier2]
Bondy Consulting Ltd London,true,[Tier2]
Bone Daddies Ltd London,true,[Tier2]
Bonhams 1793 Ltd. London,true,[Tier2]
bOnline Ltd London,true,[Tier2]
Bonneysave Limited London,true,[Tier2]
"Bonroy Petchem Co., Limited London",true,[Tier2]
Bonsoir of London Limited London,true,[Tier2]
Bonsucro Limited London,true,[Tier2]
Bookingbug Ltd London,true,[Tier2]
Bookmark Content Limited London,true,[Tier2]
Books and Periodicals Agency Ltd. London,true,[Tier2]
BookTrust London,true,[Tier2]
BOOM Collective Limited London,true,[Tier2]
BOOST&Co London,true,"[Tier2, ICT]"
Bootleg Films Limited London,true,[Tier2]
Bootstrap Company London,true,[Tier2]
Border Control Solutions Limited London,true,[Tier2]
Borderline Carpet Planning Services Limited London,true,[Tier2]
Borealis Maritime Limited London,true,[Tier2]
Born London Limited LondonLondon,true,"[Tier2, ICT]"
Borne Resourcing Limited London,true,[Tier2]
Borwood Limited London,true,[Tier2]
BOSeCO London,true,[Tier2]
Bossa Studios London,true,[Tier2]
Boster Group Limited London,true,[Tier2]
Boston Partners (UK) Limited London,true,"[Tier2, ICT]"
Boudicca Proxy Consultants Limited London,true,[Tier2]
Boulder Creek Interntional plc London,true,[Tier2]
Bounce Exchange UK Ltd London,true,"[Tier2, ICT]"
BOUNCE INTERACTIVE LTD LONDON,true,[Tier2]
Bouncepad LondonLondon,true,[Tier2]
Boundary Creek UK LLP London,true,"[Tier2, ICT]"
BOUNDARY VISUALISATION LTD LONDON,true,[Tier2]
BOUYGUES (U.K.) LIMITED LONDON,true,"[ICT, Tier2]"
Bouygues E&S FM UK Limited London,true,"[Tier2, ICT]"
Bova Specials UK Limited London,true,"[Tier2, ICT]"
Bovill Limited London,true,[Tier2]
BOW & ARROW LIMITED LONDON,true,[Tier2]
BOWER CHEMIST LONDON,true,[Tier2]
Bower Cotton Solicitors LLP London,true,[Tier2]
Bowhawk Limited London,true,[Tier2]
Bowling and Co Solicitors LondonStratford,true,[Tier2]
Box Clever Theatre Company London,true,[Tier2]
Box.com (UK) Limited London,true,"[Tier2, ICT]"
Boxberg Capital Limited LondonLondon,true,[Tier2]
Boxfusion Consulting Limited London,true,[Tier2]
BOYDEN EXECUTIVE SEARCH LIMITED LONDON,true,"[Tier2, ICT]"
Boyle Copper & Zinc Craft Ltd London,true,[Tier2]
BP plc London,true,"[Tier2, ICT]"
BPDM Limited LondonLondon,true,[Tier2]
BPDTS Ltd London,true,[Tier2]
BPI Learning Consulting UK London,true,[Tier2]
BPP Technical Services Ltd. London,true,[Tier2]
BRACEWELL (UK) LLP LONDON,true,"[Tier2, ICT]"
BRADESCO SECURITIES UK LIMITED LONDON,true,"[Tier2, ICT]"
Bradfield Consulting Ltd LondonLondon,true,[Tier2]
Braemar ACM Shipbroking Limited London,true,[Tier2]
Braemar Shipping Services PLC London,true,"[Tier2, ICT]"
Brain Labs Digital LTD CamdenLondon,true,[Tier2]
BRAINBOW LIMITED LONDON,true,[Tier2]
Brainloop Ltd No selection requiredLondon,true,[Tier2]
BRAINTREE LIMITED LONDON,true,[Tier2]
Brait Advisory Services UK Limited London,true,"[Tier2, ICT]"
Brampton College London,true,[Tier2]
Brampton Manor Academy NewhamLondon,true,[Tier2]
Branchspace Limited London,true,[Tier2]
Brand Communication Creatives UK Ltd London,true,[Tier2]
Brand Design Lab (Limited) LondonLondon,true,[Tier2]
Brand Genetics Limited London,true,[Tier2]
Brand Ice Ltd London,true,[Tier2]
Brand Squirrels Ltd London,true,[Tier2]
BrandCap Limited London,true,[Tier2]
Brandmovers Europe Ltd London,true,[Tier2]
Brandopus LLP London,true,[Tier2]
Brands2Life Limited London,true,[Tier2]
BrandsEye Ltd LondonVictoria,true,[Tier2]
Brave Bison Limited London,true,[Tier2]
BRAVO MANAGEMENT (UK) LTD LONDON,true,[Tier2]
BRAVOCOMPANY Ltd London,true,[Tier2]
Bravura Solutions (UK) Limited London,true,"[ICT, Tier2]"
Bray & Krais Solicitors London,true,[Tier2]
Braze Limited London,true,"[Tier2, ICT]"
Bread & Honey London,true,[Tier2]
Bread Ltd London,true,[Tier2]
Breakthrough Media Network Ltd London,true,[Tier2]
Breed and Craft Limited London,true,[Tier2]
Bregal Investments LLP London,true,"[Tier2, ICT]"
Breller Ltd London,true,[Tier2]
Brent Pharmacy London,true,[Tier2]
Brettenham Primary School LondonEdmonton,true,[Tier2]
Brewin Dolphin Limited London,true,[Tier2]
BRG Appliances Limited London,true,"[Tier2, ICT]"
BRG INFOTECH LIMITED London,true,[Tier2]
BriceAmery Capital Ltd LondonLondon,true,[Tier2]
Brickendon Consulting Limited LONDON,true,[Tier2]
Bridge Academy London,true,[Tier2]
Bridge Capital Ltd LondonLondon,true,[Tier2]
Bridge International Academies Limited London,true,"[Tier2, ICT]"
Bridgepoint Advisers Limited London,true,"[ICT, Tier2]"
Bridges Fund Management Limited London,true,"[Tier2, ICT]"
Bridge-U Limited London,true,[Tier2]
Brigade Capital UK LLP London,true,"[Tier2, ICT]"
Bright Little Labs EnglandLONDON,true,[Tier2]
Bright Partnerships Worldwide Limited London,true,[Tier2]
Bright Red Dot Foundation T/A CAN London,true,[Tier2]
Bright Six Limited Greater LondonLondon,true,[Tier2]
BRIGHTCOVE UK LIMITED London,true,"[Tier2, ICT]"
Brighton London Road Vision Plus Limited TA Brighton London Road Specsavers Limited SussexB ighton,true,[Tier2]
Brightside Technology Ltd London,true,[Tier2]
BrightTALK Ltd UKLondon,true,"[Tier2, ICT]"
Brillio Technologies Private Limited London,true,"[ICT, Tier2]"
Brindisa Tapas Kitchens Limited London,true,[Tier2]
BRISQQ LTD. London,true,[Tier2]
Brissenden Limited (trading as The Frameworks) London,true,"[Tier2, ICT]"
Bristows Services Limited London,true,[Tier2]
Brit Group Services Limited London,true,"[Tier2, ICT]"
BRIT Services (Technology) Limited London,true,"[Tier2, ICT]"
Britain China Trading Company Limited (BCT Ltd) London,true,[Tier2]
Britain Tamil Broadcasting UK Limited LondonHoxton,true,[Tier2]
Britannia Education Trust London,true,[Tier2]
BRITANNIA MARINE SERVICES LIMITED LONDONWIMBLEDON,true,[Tier2]
Britannia Row Productions Ltd London,true,[Tier2]
Brite Green Ltd London,true,[Tier2]
British American Tax LondonSouth Woodford,true,[Tier2]
British American Tobacco Plc London,true,"[Tier2, ICT]"
British Arab Commercial Bank Limited London,true,"[Tier2, ICT]"
BRITISH AZERBAIJANI CHAMBER OF COMMERCE LONDON,true,[Tier2]
British Beer and Pub Association London,true,[Tier2]
British Council London,true,"[Tier2, ICT]"
British Heart Foundation London,true,[Tier2]
BRITISH HORSERACING AUTHORITY LONDONLONDON,true,[Tier2]
British Library London,true,[Tier2]
British Olympic Association London,true,[Tier2]
British Orthopaedic Assocation LONDON,true,[Tier2]
British Poultry Council Limited London,true,[Tier2]
British Red Cross London,true,[Tier2]
British Retail Consortium London,true,[Tier2]
British Society for Immunology LondonLondon,true,[Tier2]
British Society for Rheumatology London,true,[Tier2]
British Standards Institution London,true,"[Tier2, ICT]"
British Study Centres School of English Ltd London,true,[Tier2]
British Tourist Authority London,true,"[Tier2, ICT]"
British Transport Police London,true,[Tier2]
British Universities & Colleges Sport London,true,[Tier2]
Broad Reach London,true,[Tier2]
Broadbean Technology Limited LondonDocklands,true,[Tier2]
Broadridge Financial Solutions Ltd London,true,"[ICT, Tier2]"
Broadstone Corporate Benefits Limited London,true,[Tier2]
Broadway Solicitors London,true,[Tier2]
Broadway Technology (UK) Limited LONDON,true,"[Tier2, ICT]"
Brolly UK Technology Limited London,true,[Tier2]
Brompton Cross Construction Limited London,true,[Tier2]
Brompton Drinks t/a Katlist London,true,[Tier2]
BRONZE NETWORK LIMITED LONDON,true,[Tier2]
Bronzemarch Trading Limited London,true,[Tier2]
brook henderson group ltd London,true,[Tier2]
Brook Street Planning Limited London,true,[Tier2]
Brook Street LONDON,true,[Tier2]
Brookfield Global Asset Management Limited London,true,"[Tier2, ICT]"
BROOKLAND PARTNERS LLP LONDON,true,[Tier2]
Brooks Murray Architects Limited London,true,[Tier2]
Brothers and Sisters London,true,[Tier2]
Browan Solicitors Ltd London,true,[Tier2]
Browhaus Limited London,true,"[ICT, Tier2]"
Brown & Batts LLP London,true,[Tier2]
Brown Advisory Limited London,true,"[Tier2, ICT]"
Brown Brothers Harriman Investor Services Limited London,true,"[ICT, Tier2]"
Brown Rudnick LLP London,true,"[Tier2, ICT]"
Brown Shipley & Co Limited London,true,[Tier2]
"Brown-Forman Beverages, Europe, Limited London",true,"[Tier2, ICT]"
Brownlow Enterprises Limited LondonHighams Park,true,[Tier2]
Brownlow Enterprises Limited LondonPalmers Green,true,[Tier2]
Brownlow Enterprises Limited LondonWhetstone,true,[Tier2]
Brownlow Enterprises Limited LondonMuswell Hill,true,[Tier2]
Browns (South Molton Street) Ltd London,true,[Tier2]
Bruce And Brown Ltd London,true,[Tier2]
Bruce Shaw LLP London,true,[Tier2]
Brunswick Consultants LTD London,true,"[ICT, Tier2]"
Brunswick House Cafe Limited London,true,[Tier2]
Bryan Cave Leighton Paisner LLP London,true,"[ICT, Tier2]"
"Bryan O'Sullivan Studio LONDONSHOREDITCH",true,[Tier2]
Bryant Artists Ltd London,true,"[Tier2, Creative]"
Bryden Wood Ltd London,true,[Tier2]
Brydg Capital LTD Greater LondonLondon,true,[Tier2]
BSA Business Software Alliance Inc London,true,[Tier2]
BSF International Ltd EnglandLondon,true,"[Tier2, ICT]"
BSS Associates Ltd London,true,[Tier2]
B-Stock Solutions Ltd London,true,[Tier2]
BT Group London,true,"[Tier2, ICT]"
BTA Limited LondonWandsworth,true,[Tier2]
BTC GROUP LONDON,true,[Tier2]
BTG International Limited London,true,"[Tier2, ICT]"
BTG Pactual Europe LLP London4-19 Berkeley Square,true,"[Tier2, ICT]"
BTIG Limited London,true,"[ICT, Tier2]"
BTVK Advisory LLP London,true,"[Tier2, ICT]"
Bubble Ltd London,true,[Tier2]
Buchanan Advertising UK Ltd London,true,"[Tier2, ICT]"
BUCHLER BARNETT SPENCER LTD LONDON,true,[Tier2]
Buck Consultants Limited London,true,"[Tier2, ICT]"
BUCKLEY GRAY YEOMAN LONDON,true,[Tier2]
Buckthorn Corporate Limited London,true,[Tier2]
Budding Learners Ltd London,true,[Tier2]
BUGS Bioscience Ltd London,true,[Tier2]
Buhler UK Limited London,true,"[Tier2, ICT]"
Buildburo Limited Greater LondonLondon,true,[Tier2]
BUILDERS UNION LLP LONDON,true,[Tier2]
BUILDING DESIGN PARTNERSHIP LIMITED t/a BDP Ltd London,true,"[Tier2, ICT]"
BUILT ENVIRONMENT REALITY CAPTURE LIMITED LONDON,true,[Tier2]
Built-ID Ltd London,true,[Tier2]
